{
  "schema_version": "1.0.0",
  "logical_run_key": "run_01a2b3c4d5e6f789",
  "experiment_id": "exp_01J6G7R8Q9ABCDEFGHJKMNPQ20",
  "correlation_id": "corr_01J6G7R8Q9ABCDEFGHJKMNPQ02",
  "configuration_id": "cfg_4f1b82d3e9a0c784",
  "task_id": "TASK-001",
  "task_version_hash": "647325057dca762d6a46813726e2764d12a98741ea7aed388acd9f3c32c814de",
  "repetition_index": 0,
  "harness_version": "pytest-8.3.0",
  "oracle_version": "oracle_v1_deterministic",
  "tool_allowlist": [
    "read_file",
    "replace_file_content",
    "run_pytest"
  ],
  "path_allowlist": [
    "parser.py",
    "test_parser.py"
  ],
  "max_turns": 15,
  "timeout_seconds": 60,
  "max_spend_usd": "0.050000",
  "created_at": "2026-08-29T10:00:25.000Z"
}
